{
  "$id": "https://schemas.ranex.dev/process/capability-domain-projection-v1.schema.json",
  "$schema": "https://json-schema.org/draft/2020-12/schema",
  "additionalProperties": false,
  "properties": {
    "approved_at": {
      "type": "string",
      "x-ranex-runtime-format": "date-time"
    },
    "artifact_type": {
      "const": "capability_domain_projection"
    },
    "assessment_authority": {
      "additionalProperties": false,
      "properties": {
        "approver_id": {
          "type": "string"
        },
        "independence_evidence_ref": {
          "type": "string"
        },
        "projector_id": {
          "type": "string"
        }
      },
      "required": [
        "projector_id",
        "approver_id",
        "independence_evidence_ref"
      ],
      "type": "object"
    },
    "core_sdlc_trace_ref": {
      "type": "string"
    },
    "correction_reason": {
      "type": "string"
    },
    "created_at": {
      "type": "string",
      "x-ranex-runtime-format": "date-time"
    },
    "decision_ref": {
      "type": "string"
    },
    "definition_evidence_refs": {
      "items": {},
      "type": "array"
    },
    "definition_status": {
      "type": "string"
    },
    "derivation": {
      "additionalProperties": false,
      "properties": {
        "applicable_member_count": {
          "minimum": 0,
          "type": "integer"
        },
        "arithmetic_aggregation_prohibited": {
          "type": "boolean"
        },
        "begun_applicable_member_count": {
          "minimum": 0,
          "type": "integer"
        },
        "bound_member_count": {
          "minimum": 0,
          "type": "integer"
        },
        "derived_level": {
          "type": [
            "string",
            "null"
          ]
        },
        "derived_result": {
          "type": "string"
        },
        "lowest_control_ids": {
          "items": {},
          "type": "array"
        },
        "not_applicable_member_count": {
          "minimum": 0,
          "type": "integer"
        },
        "registered_member_count": {
          "minimum": 0,
          "type": "integer"
        },
        "scored_applicable_member_count": {
          "minimum": 0,
          "type": "integer"
        }
      },
      "required": [
        "registered_member_count",
        "bound_member_count",
        "applicable_member_count",
        "not_applicable_member_count",
        "begun_applicable_member_count",
        "scored_applicable_member_count",
        "derived_result",
        "derived_level",
        "lowest_control_ids",
        "arithmetic_aggregation_prohibited"
      ],
      "type": "object"
    },
    "digest": {
      "type": "string",
      "x-ranex-runtime-pattern": "^sha256:[0-9a-f]{64}$"
    },
    "members": {
      "items": {
        "additionalProperties": false,
        "properties": {
          "applicability_result": {
            "type": "string"
          },
          "applicability_rule_id": {
            "type": "string"
          },
          "assessment_digest": {
            "type": "string",
            "x-ranex-runtime-pattern": "^sha256:[0-9a-f]{64}$"
          },
          "assessment_ref": {
            "type": "string"
          },
          "assessment_revision": {
            "minimum": 0,
            "type": "integer"
          },
          "assessment_scope_digest": {
            "type": "string",
            "x-ranex-runtime-pattern": "^sha256:[0-9a-f]{64}$"
          },
          "control_id": {
            "type": "string"
          },
          "domain_id": {
            "type": "string"
          },
          "level": {
            "minimum": 0,
            "type": [
              "integer",
              "null"
            ]
          },
          "priority_tier": {
            "type": [
              "string",
              "null"
            ]
          },
          "rating_result": {
            "type": "string"
          }
        },
        "required": [
          "domain_id",
          "control_id",
          "applicability_rule_id",
          "assessment_ref",
          "assessment_revision",
          "assessment_digest",
          "assessment_scope_digest",
          "applicability_result",
          "rating_result",
          "level",
          "priority_tier"
        ],
        "type": "object"
      },
      "type": "array"
    },
    "policy_id": {
      "type": "string"
    },
    "policy_version": {
      "type": "string"
    },
    "prior_projection_ref": {
      "type": "string"
    },
    "priority_projection": {
      "additionalProperties": false,
      "properties": {
        "arithmetic_aggregation_prohibited": {
          "type": "boolean"
        },
        "decisive_control_ids": {
          "items": {},
          "type": "array"
        },
        "derived_tier": {
          "type": [
            "string",
            "null"
          ]
        },
        "priority_rule_digest": {
          "type": "string",
          "x-ranex-runtime-pattern": "^sha256:[0-9a-f]{64}$"
        },
        "priority_rule_id": {
          "type": "string"
        },
        "priority_rule_version": {
          "type": "string"
        },
        "result": {
          "type": "string"
        }
      },
      "required": [
        "priority_rule_id",
        "priority_rule_version",
        "priority_rule_digest",
        "result",
        "derived_tier",
        "decisive_control_ids",
        "arithmetic_aggregation_prohibited"
      ],
      "type": "object"
    },
    "projection_id": {
      "type": "string"
    },
    "revision": {
      "minimum": 0,
      "type": "integer"
    },
    "rubric_id": {
      "type": "string"
    },
    "rubric_version": {
      "type": "string"
    },
    "schema_version": {
      "const": "1"
    },
    "scope": {
      "additionalProperties": false,
      "properties": {
        "domain_id": {
          "type": "string"
        },
        "risk_lanes": {
          "items": {},
          "type": "array"
        },
        "scope_digest": {
          "type": "string",
          "x-ranex-runtime-pattern": "^sha256:[0-9a-f]{64}$"
        },
        "service_ids": {
          "items": {},
          "type": "array"
        },
        "value_stream_ids": {
          "items": {},
          "type": "array"
        },
        "window_end": {
          "type": "string",
          "x-ranex-runtime-format": "date-time"
        },
        "window_start": {
          "type": "string",
          "x-ranex-runtime-format": "date-time"
        },
        "work_classes": {
          "items": {},
          "type": "array"
        }
      },
      "required": [
        "domain_id",
        "service_ids",
        "value_stream_ids",
        "work_classes",
        "risk_lanes",
        "window_start",
        "window_end",
        "scope_digest"
      ],
      "type": "object"
    },
    "status": {
      "type": "string"
    },
    "subject_digest": {
      "type": "string",
      "x-ranex-runtime-pattern": "^sha256:[0-9a-f]{64}$"
    },
    "subject_manifest_digest": {
      "type": "string",
      "x-ranex-runtime-pattern": "^sha256:[0-9a-f]{64}$"
    },
    "subject_ref": {
      "type": "string"
    },
    "subject_schema": {
      "type": "string"
    },
    "supersedes_ref": {
      "type": "string"
    },
    "validation": {
      "additionalProperties": false,
      "properties": {
        "applicability_rating_consistency_result": {
          "type": "string"
        },
        "exact_tuple_set_result": {
          "type": "string"
        },
        "identical_scope_and_window_result": {
          "type": "string"
        },
        "immutable_binding_result": {
          "type": "string"
        },
        "no_duplicate_or_extra_member_result": {
          "type": "string"
        },
        "validation_evidence_refs": {
          "items": {},
          "type": "array"
        }
      },
      "required": [
        "exact_tuple_set_result",
        "no_duplicate_or_extra_member_result",
        "identical_scope_and_window_result",
        "immutable_binding_result",
        "applicability_rating_consistency_result",
        "validation_evidence_refs"
      ],
      "type": "object"
    },
    "vital_profile": {
      "additionalProperties": false,
      "properties": {
        "applicability_registry_digest": {
          "type": "string",
          "x-ranex-runtime-pattern": "^sha256:[0-9a-f]{64}$"
        },
        "applicability_registry_id": {
          "type": "string"
        },
        "applicability_registry_version": {
          "type": "string"
        },
        "profile_digest": {
          "type": "string",
          "x-ranex-runtime-pattern": "^sha256:[0-9a-f]{64}$"
        },
        "profile_id": {
          "type": "string"
        },
        "profile_version": {
          "type": "string"
        }
      },
      "required": [
        "profile_id",
        "profile_version",
        "profile_digest",
        "applicability_registry_id",
        "applicability_registry_version",
        "applicability_registry_digest"
      ],
      "type": "object"
    }
  },
  "required": [
    "schema_version",
    "artifact_type",
    "projection_id",
    "revision",
    "status",
    "definition_status",
    "definition_evidence_refs",
    "subject_schema",
    "subject_ref",
    "subject_digest",
    "subject_manifest_digest",
    "core_sdlc_trace_ref",
    "policy_id",
    "policy_version",
    "rubric_id",
    "rubric_version",
    "scope",
    "vital_profile",
    "members",
    "validation",
    "derivation",
    "priority_projection",
    "assessment_authority",
    "decision_ref",
    "approved_at",
    "prior_projection_ref",
    "supersedes_ref",
    "correction_reason",
    "created_at",
    "digest"
  ],
  "title": "capability_domain_projection",
  "type": "object",
  "x-ranex-canonical-producer": "process_assurance",
  "x-ranex-runtime-semantics": "scripts/architecture/validate_contracts.py",
  "x-ranex-template": "docs/architecture/templates/CAPABILITY_DOMAIN_PROJECTION.yaml"
}
