{
  "approved_at": "",
  "artifact_type": "capability_domain_projection",
  "assessment_authority": {
    "approver_id": "UNASSIGNED_WAVE_2",
    "independence_evidence_ref": "",
    "projector_id": "scripts/architecture/generate_contracts.py"
  },
  "core_sdlc_trace_ref": "",
  "correction_reason": "",
  "created_at": "2026-07-28T00:00:00Z",
  "decision_ref": "",
  "definition_evidence_refs": [
    "architecture/contracts/vital-profile.json"
  ],
  "definition_status": "DEFINED",
  "derivation": {
    "applicable_member_count": 0,
    "arithmetic_aggregation_prohibited": true,
    "begun_applicable_member_count": 0,
    "bound_member_count": 5,
    "derived_level": null,
    "derived_result": "UNKNOWN",
    "lowest_control_ids": [],
    "not_applicable_member_count": 0,
    "registered_member_count": 5,
    "scored_applicable_member_count": 0
  },
  "digest": "sha256:c568f84d4451d2293b26b6a73ec09b7ecd380f9295652ab7bb460cdacff434be",
  "members": [
    {
      "applicability_result": "UNKNOWN",
      "applicability_rule_id": "APP-CROSS-001",
      "assessment_digest": "sha256:aced2c6b73ad5e15500b9ac7f7c3a008741a9bf3b6cad49848900fa16289bee9",
      "assessment_ref": "docs/architecture/assessments/controls/SDLC-TR-001.json",
      "assessment_revision": 1,
      "assessment_scope_digest": "sha256:6dbfa32750fa3f035f1c3ace98464aa672eb30c1ed18956e3c330cd3684e83b7",
      "control_id": "SDLC-TR-001",
      "domain_id": "CAP-GOVERN-EVIDENCE",
      "level": null,
      "priority_tier": null,
      "rating_result": "NOT_ASSESSED"
    },
    {
      "applicability_result": "UNKNOWN",
      "applicability_rule_id": "APP-CROSS-001",
      "assessment_digest": "sha256:ba1791ff2184f96d6410a58014ef8ad8d6989ce5f60d49fb705b3b3ab8ef7a55",
      "assessment_ref": "docs/architecture/assessments/controls/SDLC-TAIL-001.json",
      "assessment_revision": 1,
      "assessment_scope_digest": "sha256:4bcca29532e6fea8704179e85acf6b93b1e1b92a57972173865545068718e2b5",
      "control_id": "SDLC-TAIL-001",
      "domain_id": "CAP-GOVERN-EVIDENCE",
      "level": null,
      "priority_tier": null,
      "rating_result": "NOT_ASSESSED"
    },
    {
      "applicability_result": "UNKNOWN",
      "applicability_rule_id": "APP-CROSS-001",
      "assessment_digest": "sha256:257acdc054cb0d40b71b1a59acceecb3bca39d2174cef4a45c04e5de144b933c",
      "assessment_ref": "docs/architecture/assessments/controls/SDLC-MEA-001.json",
      "assessment_revision": 1,
      "assessment_scope_digest": "sha256:b27db7f74f2645fc7b5c81479e1ed7b27de66232b8a538ce13f0d50d3ed59784",
      "control_id": "SDLC-MEA-001",
      "domain_id": "CAP-GOVERN-EVIDENCE",
      "level": null,
      "priority_tier": null,
      "rating_result": "NOT_ASSESSED"
    },
    {
      "applicability_result": "UNKNOWN",
      "applicability_rule_id": "APP-CROSS-001",
      "assessment_digest": "sha256:f398b274ac46d8f55b3b15d0c5a0301653b789dfdbfdfa74f2f230de357bafce",
      "assessment_ref": "docs/architecture/assessments/controls/SDLC-MEA-002.json",
      "assessment_revision": 1,
      "assessment_scope_digest": "sha256:70bf55eb5acc35e3c7da218ac256dba67eae620d412c3cb1eeb7c1e808f25980",
      "control_id": "SDLC-MEA-002",
      "domain_id": "CAP-GOVERN-EVIDENCE",
      "level": null,
      "priority_tier": null,
      "rating_result": "NOT_ASSESSED"
    },
    {
      "applicability_result": "UNKNOWN",
      "applicability_rule_id": "APP-CROSS-001",
      "assessment_digest": "sha256:ba0a834674fa0e04f8a968c550f7554af9c3a3bbc981001c165fdc11372c73f7",
      "assessment_ref": "docs/architecture/assessments/controls/SDLC-PA-001.json",
      "assessment_revision": 1,
      "assessment_scope_digest": "sha256:2d7e11191e33c32a9399f6f928ef31a029f46c80749b7d99bc0d3fdaffd36b10",
      "control_id": "SDLC-PA-001",
      "domain_id": "CAP-GOVERN-EVIDENCE",
      "level": null,
      "priority_tier": null,
      "rating_result": "NOT_ASSESSED"
    }
  ],
  "policy_id": "POL-SDLC-001",
  "policy_version": "1.4.0",
  "prior_projection_ref": "",
  "priority_projection": {
    "arithmetic_aggregation_prohibited": true,
    "decisive_control_ids": [],
    "derived_tier": null,
    "priority_rule_digest": "sha256:7ce8ccde49b5c9e0cab085ddbe56f0e382c224a2595d08924c5c575a447c5f88",
    "priority_rule_id": "PRIORITY-SDLC-001",
    "priority_rule_version": "1.0.0",
    "result": "NOT_EVALUATED"
  },
  "projection_id": "capability_domain_projection_019fa605-6800-7a90-aaf8-4f4b1b532b18",
  "revision": 1,
  "rubric_id": "SDLC-MEA-002",
  "rubric_version": "3.0.0",
  "schema_version": "1",
  "scope": {
    "domain_id": "CAP-GOVERN-EVIDENCE",
    "risk_lanes": [
      "STANDARD",
      "ENHANCED",
      "CRITICAL",
      "EMERGENCY"
    ],
    "scope_digest": "sha256:5ae307cbe67f8298a929618697ea61152eb215b837239a2757989a3c815d6252",
    "service_ids": [
      "RANEX_TARGET"
    ],
    "value_stream_ids": [
      "ARCHITECTURE_CONTRACTING"
    ],
    "window_end": "2026-07-28T00:00:00Z",
    "window_start": "2026-07-28T00:00:00Z",
    "work_classes": [
      "PRODUCT",
      "DEFECT",
      "RELIABILITY",
      "SECURITY_PRIVACY",
      "ARCHITECTURE_PLATFORM",
      "COMPLIANCE_PROVENANCE",
      "UPSTREAM_SYNC",
      "MAINTENANCE",
      "RETIREMENT",
      "INCIDENT_RESPONSE"
    ]
  },
  "status": "NOT_ASSESSED",
  "subject_digest": "sha256:028e82c057e88f1bf89f3e5e3f6041f4c58170bd0963799f0c82593743bb53af",
  "subject_manifest_digest": "sha256:83ac19685c50b95d1837862fa62d015f2d2030d2f2e14474e72679030a89ac40",
  "subject_ref": "art_019fa605-6800-7900-9950-db32813e6dca",
  "subject_schema": "research-subject/v1",
  "supersedes_ref": "",
  "validation": {
    "applicability_rating_consistency_result": "PASS",
    "exact_tuple_set_result": "PASS",
    "identical_scope_and_window_result": "PASS",
    "immutable_binding_result": "PASS",
    "no_duplicate_or_extra_member_result": "PASS",
    "validation_evidence_refs": [
      "scripts/architecture/validate_contracts.py"
    ]
  },
  "vital_profile": {
    "applicability_registry_digest": "sha256:70aa533eb87375970768ee6effc259aa26bf425c2277886d7a88e11c03619042",
    "applicability_registry_id": "APPLICABILITY-SDLC-001",
    "applicability_registry_version": "1.1.0",
    "profile_digest": "sha256:4a8bbc57831194d46bec0fe86121443b6fdfd2fb850c3cf9852b3a497f121550",
    "profile_id": "VITAL-SDLC-001",
    "profile_version": "1.1.0"
  }
}
