{
  "approved_at": "",
  "artifact_type": "capability_domain_projection",
  "assessment_authority": {
    "approver_id": "UNASSIGNED_WAVE_2",
    "independence_evidence_ref": "",
    "projector_id": "scripts/architecture/generate_contracts.py"
  },
  "core_sdlc_trace_ref": "",
  "correction_reason": "",
  "created_at": "2026-07-28T00:00:00Z",
  "decision_ref": "",
  "definition_evidence_refs": [
    "architecture/contracts/vital-profile.json"
  ],
  "definition_status": "DEFINED",
  "derivation": {
    "applicable_member_count": 0,
    "arithmetic_aggregation_prohibited": true,
    "begun_applicable_member_count": 0,
    "bound_member_count": 2,
    "derived_level": null,
    "derived_result": "UNKNOWN",
    "lowest_control_ids": [],
    "not_applicable_member_count": 0,
    "registered_member_count": 2,
    "scored_applicable_member_count": 0
  },
  "digest": "sha256:6694b04f2b7f878395ec75557d9577843c6ad5b55be9c44edaaaa5398df10173",
  "members": [
    {
      "applicability_result": "UNKNOWN",
      "applicability_rule_id": "APP-STAGE-001",
      "assessment_digest": "sha256:4bf7e446f60732b889f091439bb18e2a335eca708991556b0bdd59461ced06c4",
      "assessment_ref": "docs/architecture/assessments/controls/SDLC-INT-001.json",
      "assessment_revision": 1,
      "assessment_scope_digest": "sha256:bc480bd343513ef2dfae631a5e953e84c6e70e4c34b52c066d18f88390975f2c",
      "control_id": "SDLC-INT-001",
      "domain_id": "CAP-INTAKE-TRIAGE",
      "level": null,
      "priority_tier": null,
      "rating_result": "NOT_ASSESSED"
    },
    {
      "applicability_result": "UNKNOWN",
      "applicability_rule_id": "APP-STAGE-001",
      "assessment_digest": "sha256:dfad6fdbdd97bfc418004e3b292a2b83ad0de532c63a59a9f2f4b1c40250b618",
      "assessment_ref": "docs/architecture/assessments/controls/SDLC-TRI-001.json",
      "assessment_revision": 1,
      "assessment_scope_digest": "sha256:a5599326fac0812662d2ea1390b82e8bc78660b9f2130712ffc68029ee38e551",
      "control_id": "SDLC-TRI-001",
      "domain_id": "CAP-INTAKE-TRIAGE",
      "level": null,
      "priority_tier": null,
      "rating_result": "NOT_ASSESSED"
    }
  ],
  "policy_id": "POL-SDLC-001",
  "policy_version": "1.4.0",
  "prior_projection_ref": "",
  "priority_projection": {
    "arithmetic_aggregation_prohibited": true,
    "decisive_control_ids": [],
    "derived_tier": null,
    "priority_rule_digest": "sha256:7ce8ccde49b5c9e0cab085ddbe56f0e382c224a2595d08924c5c575a447c5f88",
    "priority_rule_id": "PRIORITY-SDLC-001",
    "priority_rule_version": "1.0.0",
    "result": "NOT_EVALUATED"
  },
  "projection_id": "capability_domain_projection_019fa605-6800-7291-be66-d8a96ebce309",
  "revision": 1,
  "rubric_id": "SDLC-MEA-002",
  "rubric_version": "3.0.0",
  "schema_version": "1",
  "scope": {
    "domain_id": "CAP-INTAKE-TRIAGE",
    "risk_lanes": [
      "STANDARD",
      "ENHANCED",
      "CRITICAL",
      "EMERGENCY"
    ],
    "scope_digest": "sha256:a68c5ed0665cbd2c5d19acb8d3024d87ddb1e9bf139d11652d830410b25b7f61",
    "service_ids": [
      "RANEX_TARGET"
    ],
    "value_stream_ids": [
      "ARCHITECTURE_CONTRACTING"
    ],
    "window_end": "2026-07-28T00:00:00Z",
    "window_start": "2026-07-28T00:00:00Z",
    "work_classes": [
      "PRODUCT",
      "DEFECT",
      "RELIABILITY",
      "SECURITY_PRIVACY",
      "ARCHITECTURE_PLATFORM",
      "COMPLIANCE_PROVENANCE",
      "UPSTREAM_SYNC",
      "MAINTENANCE",
      "RETIREMENT",
      "INCIDENT_RESPONSE"
    ]
  },
  "status": "NOT_ASSESSED",
  "subject_digest": "sha256:9ffde5dbeec8452c4b0c719773728e13a995772950018a451aecc951bc756735",
  "subject_manifest_digest": "sha256:4b98bf61c379a39872fbef13bbfde30dbab90d349b184632e01f9a6e681d9732",
  "subject_ref": "art_019fa605-6800-7900-9950-db32813e6dca",
  "subject_schema": "research-subject/v1",
  "supersedes_ref": "",
  "validation": {
    "applicability_rating_consistency_result": "PASS",
    "exact_tuple_set_result": "PASS",
    "identical_scope_and_window_result": "PASS",
    "immutable_binding_result": "PASS",
    "no_duplicate_or_extra_member_result": "PASS",
    "validation_evidence_refs": [
      "scripts/architecture/validate_contracts.py"
    ]
  },
  "vital_profile": {
    "applicability_registry_digest": "sha256:70aa533eb87375970768ee6effc259aa26bf425c2277886d7a88e11c03619042",
    "applicability_registry_id": "APPLICABILITY-SDLC-001",
    "applicability_registry_version": "1.1.0",
    "profile_digest": "sha256:4a8bbc57831194d46bec0fe86121443b6fdfd2fb850c3cf9852b3a497f121550",
    "profile_id": "VITAL-SDLC-001",
    "profile_version": "1.1.0"
  }
}
