{
  "approved_at": "",
  "artifact_type": "capability_domain_projection",
  "assessment_authority": {
    "approver_id": "UNASSIGNED_WAVE_2",
    "independence_evidence_ref": "",
    "projector_id": "scripts/architecture/generate_contracts.py"
  },
  "core_sdlc_trace_ref": "",
  "correction_reason": "",
  "created_at": "2026-07-28T00:00:00Z",
  "decision_ref": "",
  "definition_evidence_refs": [
    "architecture/contracts/vital-profile.json"
  ],
  "definition_status": "DEFINED",
  "derivation": {
    "applicable_member_count": 0,
    "arithmetic_aggregation_prohibited": true,
    "begun_applicable_member_count": 0,
    "bound_member_count": 2,
    "derived_level": null,
    "derived_result": "UNKNOWN",
    "lowest_control_ids": [],
    "not_applicable_member_count": 0,
    "registered_member_count": 2,
    "scored_applicable_member_count": 0
  },
  "digest": "sha256:a5695801acc87d133f661f02fadc395427b96266183ad18693131298592b35c3",
  "members": [
    {
      "applicability_result": "UNKNOWN",
      "applicability_rule_id": "APP-STAGE-001",
      "assessment_digest": "sha256:c3a122dd4ec3ac4190e3488e9bf981200c0f96b67bb312d443a929e023d67bb6",
      "assessment_ref": "docs/architecture/assessments/controls/SDLC-OPS-001.json",
      "assessment_revision": 1,
      "assessment_scope_digest": "sha256:de0eb5b9e1e43ae9244519d92035beb0ccb8b7b003064170586a57a1f7e03033",
      "control_id": "SDLC-OPS-001",
      "domain_id": "CAP-OPERATE-MAINTAIN",
      "level": null,
      "priority_tier": null,
      "rating_result": "NOT_ASSESSED"
    },
    {
      "applicability_result": "UNKNOWN",
      "applicability_rule_id": "APP-TRIGGER-001",
      "assessment_digest": "sha256:faa99c5b331996ee41beed28670a8cbfd05877a31e21d1c5f3959db7efcdf842",
      "assessment_ref": "docs/architecture/assessments/controls/SDLC-MNT-001.json",
      "assessment_revision": 1,
      "assessment_scope_digest": "sha256:0f473a80bb146dc183badc440473089d941c1864192c34d9afb2abb6523af5ba",
      "control_id": "SDLC-MNT-001",
      "domain_id": "CAP-OPERATE-MAINTAIN",
      "level": null,
      "priority_tier": null,
      "rating_result": "NOT_ASSESSED"
    }
  ],
  "policy_id": "POL-SDLC-001",
  "policy_version": "1.4.0",
  "prior_projection_ref": "",
  "priority_projection": {
    "arithmetic_aggregation_prohibited": true,
    "decisive_control_ids": [],
    "derived_tier": null,
    "priority_rule_digest": "sha256:7ce8ccde49b5c9e0cab085ddbe56f0e382c224a2595d08924c5c575a447c5f88",
    "priority_rule_id": "PRIORITY-SDLC-001",
    "priority_rule_version": "1.0.0",
    "result": "NOT_EVALUATED"
  },
  "projection_id": "capability_domain_projection_019fa605-6800-753b-b694-73984775f695",
  "revision": 1,
  "rubric_id": "SDLC-MEA-002",
  "rubric_version": "3.0.0",
  "schema_version": "1",
  "scope": {
    "domain_id": "CAP-OPERATE-MAINTAIN",
    "risk_lanes": [
      "STANDARD",
      "ENHANCED",
      "CRITICAL",
      "EMERGENCY"
    ],
    "scope_digest": "sha256:2811c7aa21a32f1b061c27e1015b9bfea684a780f4bcd54a5d39537271faebec",
    "service_ids": [
      "RANEX_TARGET"
    ],
    "value_stream_ids": [
      "ARCHITECTURE_CONTRACTING"
    ],
    "window_end": "2026-07-28T00:00:00Z",
    "window_start": "2026-07-28T00:00:00Z",
    "work_classes": [
      "PRODUCT",
      "DEFECT",
      "RELIABILITY",
      "SECURITY_PRIVACY",
      "ARCHITECTURE_PLATFORM",
      "COMPLIANCE_PROVENANCE",
      "UPSTREAM_SYNC",
      "MAINTENANCE",
      "RETIREMENT",
      "INCIDENT_RESPONSE"
    ]
  },
  "status": "NOT_ASSESSED",
  "subject_digest": "sha256:9ffde5dbeec8452c4b0c719773728e13a995772950018a451aecc951bc756735",
  "subject_manifest_digest": "sha256:4b98bf61c379a39872fbef13bbfde30dbab90d349b184632e01f9a6e681d9732",
  "subject_ref": "art_019fa605-6800-7900-9950-db32813e6dca",
  "subject_schema": "research-subject/v1",
  "supersedes_ref": "",
  "validation": {
    "applicability_rating_consistency_result": "PASS",
    "exact_tuple_set_result": "PASS",
    "identical_scope_and_window_result": "PASS",
    "immutable_binding_result": "PASS",
    "no_duplicate_or_extra_member_result": "PASS",
    "validation_evidence_refs": [
      "scripts/architecture/validate_contracts.py"
    ]
  },
  "vital_profile": {
    "applicability_registry_digest": "sha256:70aa533eb87375970768ee6effc259aa26bf425c2277886d7a88e11c03619042",
    "applicability_registry_id": "APPLICABILITY-SDLC-001",
    "applicability_registry_version": "1.1.0",
    "profile_digest": "sha256:4a8bbc57831194d46bec0fe86121443b6fdfd2fb850c3cf9852b3a497f121550",
    "profile_id": "VITAL-SDLC-001",
    "profile_version": "1.1.0"
  }
}
